image_num,format,name,category,description
179,Box,Supertogether Phone Case,Nerd & Novelty,Get a new phone case delivered every month for just $9.99 to keep your phone looking fresh and funky!
180,Box,Stuff You Need Cheap,Just for Men,Stop going commando and burning holes through your socks! Step up your game with a monthly delivery of quality killer socks and underwear.
181,Box,FlourishBox,Beauty & Fashion,"Handcrafted, globally sourced scarves, plus two extra fair trade treats."
182,Box,nailbox,Just for Women,"nailbox is a brand new, monthly subscription box full of the hottest nail polish and essential nail tools."
183,Box,All Things Needed,Just for Women,Get samples created for women and provided by women delivered right to your door every month!
184,Box,Amenities Box,Just for Men,"Amenities Box is a subscription box that has all personal amenities and products including soap, deodorant, shampoo, toothpaste and more."
185,Box,Say it with a Sock,Beauty & Fashion,Sock of the Month Club
186,Box,Pipsticks,Art & Culture,Pipsticks sends an awesome pack of curated stickers from suppliers around the world to our subscribers every month. Sticker lovers unite!
187,Box,Moustache Stationery,Art & Culture,We scour the earth for the most amazing stationery products. Every month we curate an exclusive box for our subscribers.
188,Box,Very Portland,Food & Artisan Edibles,"Ironically made in Portland, we're the monthly subscription service featuring the best local artisans in our city."
189,Box,Helene Jewelry,Beauty & Fashion,Want some ArmCandy to Show-Off? Subscribe to receive a box full of trendy bracelets and other goodies selected just for you each month.
190,Box,24Tees,Beauty & Fashion,24Tees is a Premium T-Shirt Subscription Box. Each month we release 4 Unique Designs. When you're signed up you pick the 2 you love most.
191,Box,CraftyKatie,Art & Culture,A monthly subscription box for arts and crafts lovers filled with hand-made items!
192,Box,Clean Bar Box,Eco & Natural,Clean Bar Box is a monthly soap subscription box that delivers four new scents of handmade artisan crafted soap every month!
193,Box,Scent Trunk,Nerd & Novelty,Your perfect scents delivered on your schedule
194,Box,Boxycharm,Beauty & Fashion,A beauty box subscription that surprises you each month with the best beauty products from popular and chic brands.
195,Box,Terra Bella,Beauty & Fashion,"The best natural products for your bath and beauty routine. We source natural products, handmade in small batches by small businesses."
196,Box,B4 Shirts,Fitness & Health,Get amazing t-shirts every 3 months featuring your favorite sport!
197,Box,Pure Good Spa Kit,Beauty & Fashion,"Our monthly spa kit features four beautifully designed and indulgent vegan, food-grade face treatments to pamper your skin and your soul."
198,Box,Cannabox,Nerd & Novelty,A monthly of box of awesome. Shipped every month.
199,Box,Native Box,Eco & Natural,Discover healthier product choices with a sample box delivered to your door each month.
200,Box,Flicker Box,Art & Culture,A variety of artisanal candles made from candle artists in the U.S.A
201,Box,Prize Candle,Eco & Natural,"Discover a beautiful ring hidden in every soy candle AND a chance to win a prize up to $5,000."
202,Box,GoodeBox,Eco & Natural,"Expertly curated, healthy, natural and non-toxic beauty products delivered monthly"
203,Box,Graze,Food & Artisan Edibles,"Don't just snack, Graze!"
204,Box,Yogi Surprise Lifestyle Box,Eco & Natural,A yoga inspired monthly delivery designed to complement your active lifestyle of vitality and growth
205,Box,Vegan Cuts Beauty Box,Beauty & Fashion,Discover a variety of cruelty-free beauty brands once a month.
206,Box,Handmade Cartel,Beauty & Fashion,From the makers of theOrganicLoft.com - A lifestyle subscription service specializing in handmade cruelty free products.
207,Box,Moon Magic Box,Eco & Natural,"The Moon Magic Box is a collection of treasures, gifts and surprises that aid in tuning and energizing your body, mind and spirit!"
208,Box,Hazel Lane,Art & Culture,"The BEST OF locally produced organic, eco-chic, hipster goods from a new US locale. Destination subscription box and online a la carte Shop"
209,Box,Vegan Cuts Snack Box,Eco & Natural,"Ethical, vegan snacks delivered monthly."
210,Box,International Blessings,Beauty & Fashion,"Unique, beautiful jewelry and products fighting poverty! Handmade by impoverished artisans. 10% donation goes to poverty fighting causes."
211,Box,Taste Guru,Food & Artisan Edibles,"Every month Taste Guru brings you delicious gluten-free options, helping you explore the tastier side of healthy."
212,Box,Yuzen,Eco & Natural,"A quarterly 'spa' box filled with natural, ethical, products."
213,Box,Pip & Lola's Everything Homemade,Beauty & Fashion,"We specialize in ""barely scented all-natural handmade and hand cut soaps. Pick a ONE or TWO bar monthly or 3/6/12 month prepaid soapy box."""
214,Box,Yogi Surprise Jewelry Box,Just for Women,"Beautiful, handcrafted yoga inspired jewelry pieces delivered monthly"
215,Box,Bestowed,Fitness & Health,"The best healthy snacks, beverages, and lifestyle items straight to your door."
216,Box,UrthBox,Eco & Natural,"A monthly collection of healthy snacks, beverages and more!"
217,Box,Spa Heroes,Beauty & Fashion,"The simplest way to safer skincare. Spa Heroes delivers non-toxic beauty to your door, one 'Hero Product' at a time. Use Less. Love More."
218,Box,Loose Tea Addict,Food & Artisan Edibles,Would you like to try premium loose leaf teas without the hassle of paying big name tea prices? Then our monthly box is for you! Join now!
219,Box,Plum Deluxe Tea,Food & Artisan Edibles,"Signup & enjoy a limited-edition artisan tea each month, carefully crafted with only the freshest organic ingredients infused with love."
220,Box,Mystical Mojo Box,Eco & Natural,Assisting You In Your Spiritual Journey. Is it time to fill up your spiritual toolbox? Mystical Goodies delivered monthly
221,Box,My Texas Market,Food & Artisan Edibles,Bringing the farmer's market to your doorstep.
222,Box,Num-Nums Munch Box,Food & Artisan Edibles,"""Box-of-the-Month club for allergy-conscious or vegan snacks. Each month we will ship a box full of hand-picked goodies right to your door!"""
223,Box,The GlobeIn Artisan Box,Eco & Natural,The GlobeIn Artisan Box is the smartest way to discover mindful food and lifestyle products from around the world.
224,Box,SilkCrate,Eco & Natural,"Have high quality, handmade bath and spa goodies delivered to your door monthly."
225,Box,Backpacker Box,Food & Artisan Edibles,"BackpackerBox provides subscribers with a slice of the outdoors through delicious snacks and meals, quality gear and backpacking literature"
226,Box,Honest Company,Eco & Natural,"Premium natural, non-toxic personal care & home cleaning essentials"
227,Box,Box Me Mommy,Eco & Natural,Enjoy a monthly box of fun for mommy and baby.
228,Box,Stashbox,Nerd & Novelty,Get high-end smoking gear delivered to your door monthly.
229,Box,GoodMouth,Eco & Natural,"Beautifully Designed, Socially Conscious.Toothbrushes to Your Door Right When You Need Them."
230,Box,The Beaver Box,Just for Women,A stylish subscription box delivered quarterly to Canadian Women.
231,Box,Urban Organic Gardener,Eco & Natural,Get a unique collection of garden seeds delivered to you every month -- At the right time to plant them -- Specially selected just for you.
232,Box,Farm Fresh To You,Food & Artisan Edibles,Organic fruits and vegetables delivered fresh from our farm to your doorstep.
233,Box,Date in a Crate,Eco & Natural,"Improving relationships, one night at a time by providing monthly date night boxes that save time, money, and stress. All you do is enjoy the moment."
234,Box,Best Kept Rx,Just for Women,"Put your self-care on autopilot with a dose of Best Kept Rx - Practical products for busy women, delivered to doorsteps four times a year."
235,Box,Bag and Wander,Just for Women,Delivering practical travel-size essentials to keep you comfortable & prepared on-the-go.
236,Box,Monthly Express,Eco & Natural,Discover the luxurious relaxation inside each of our collections.
237,Box,Sperobox,Just for Women,One time or subscription box to empower women globally & equips you to advocate.
238,Box,Junior Explorers,Family & Kids,Junior Explorers is a subscription for kids that teaches them about wildlife and nature through adventures sent home and continued online!
239,Box,Homegrown Collective,Eco & Natural,"Receive a seasonally appropriate, professionally curated box of products that deliver the satisfaction of living a more self-sufficient & sustainable lifestyle to your doorstep each month."
240,Box,Prospurly,Food & Artisan Edibles,"An artisanal monthly subscription crafted for mind, body and soul."
241,Box,Carolina Monthly,Food & Artisan Edibles,"Monthly subscription service of Carolina goodness, hand-picked with you in mind."
242,Box,Healthy Foodie Box,Food & Artisan Edibles,"Healthy Foodie Box discover, curate and deliver quality healthy snacks to your door."
243,Box,BoxDetox,Eco & Natural,"BoxDetox is the only detox discovery box with happiness, health and fitness as core components."
244,Box,21 Bundles,Family & Kids,"We deliver monthly bundles of natural products to pregnant and new Moms, tailored to their stage of pregnancy or their baby's age."
245,Box,Ecocentric Mom,Eco & Natural,"The best place for a healthy, ecocentric, and all-natural lifestyle! Join our community!"
246,Box,holBOX,Eco & Natural,Monthly subscription service for women seeking to transition into living holistically.
247,Box,Teens Turning Green Conscious Collection,Eco & Natural,"The Conscious Collections highlight thoughtfully curated, ethically-produced products across many lifestyle categories."
248,Box,Campbox Company,Fitness & Health,We curate camping & hiking gear based on seasonal weather. Our goal is keeping you prepared anytime adventure calls.
249,Box,Conscious Box,Eco & Natural,"Get new healthy, GMO-free goods to try, love, and buy."
250,Box,calmbox,Eco & Natural,"A monthly box helping inspire positivity, peace, and calm in your everyday life."
251,Box,Timely Tea,Eco & Natural,Timely Tea is a monthly loose leaf tea subscription. We provide three unique flavors for a total of 30-35 cups per month
252,Box,LaRitzy,Beauty & Fashion,Get monthly deliveries of full-sized all-natural skincare products.
253,Box,The Butter Box,Eco & Natural,"Every Month in The Butter Box is 100% natural, we never use any chemicals or chemically-altered natural ingredients!"
254,Box,Your Secret Admirer,Just for Women,Your Secret Admirer delivers a box of hand-selected items designed to make every woman feel appreciated.
255,Box,Harvest,Food & Artisan Edibles,Quarterly harvest delivered to your door. Enjoy the finest wine country has to offer each season.
256,Box,MyLadyBug,Just for Women,"A monthly period subscription service that deliver your monthly products direct to your door, just when you need it the most."
257,Box,The Disc Golf Box Company,Fitness & Health,Let us put together a customized Box of Disc Golf Awesomeness loaded with Contributions from Retailers all across the country just for you.
258,Box,Decoterie: Monthly Decor Subscription Box,Just for Women,"Home decor box for a cause. Exclusive homewares, decorative accessories; objects of desire curated by Letitia Elizabeth. 10% goes to charity"
259,Box,Foxy Boxes,Fitness & Health,"Each month, as a member, you will receive a box loaded with supplements, healthy snacks, accessories and nutrition products."
260,Box,FlourishBox,Beauty & Fashion,"Handcrafted, globally sourced scarves, plus two extra fair trade treats."
261,Box,Pure Good Spa Kit,Eco & Natural,"Treat yourself to a weekly spa retreat with four facial treatments that soothe, heal and brighten both your dermis and your soul."
262,Box,Boxtera,Food & Artisan Edibles,"Our natural Boxtera snacks satisfy all the tastes of your gustatory perception; savory, sweet, sour, bitter and salty!"
263,Box,All Things Needed,Just for Women,Get samples created for women and provided by women delivered right to your door every month!
264,Box,Very Portland,Food & Artisan Edibles,"Ironically made in Portland, we're the monthly subscription service featuring the best local artisans in our city."
265,Box,MoonBox by Gaia Collective,Eco & Natural,Deepen your connection with a MoonBox subscription.
266,Box,Auracrate,Eco & Natural,"Auracrate is a monthly subscription box for Premium Eco friendly Air Fresheners and Purifiers from Europe, Asia and N.America."
267,Box,Community Supported Chocolate,Food & Artisan Edibles,This subscription features a mouthwatering assortment of chocolates crafted to nourish the mind & invigorate the senses on a monthly basis.
268,Box,Our Little Roots,Family & Kids,"Let your child explore nature at its finest, starting from a single seed."
269,Box,Clean Bar Box,Eco & Natural,Clean Bar Box is a monthly soap subscription box that delivers four new scents of handmade artisan crafted soap every month!
270,Box,Mindfulness Box,Eco & Natural,"Looking for balance, positivity & zen? Mindfulness Box provides simple reminders & inspiring goods sure to encourage living in the moment."
271,Box,Student Velocity,Eco & Natural,"Subscription box service for Canadian students. Get delicious snacks, and exciting gifts right to your dorm, apartment, or home!"
272,Box,The Community Chest,Food & Artisan Edibles,"The Community Chest subscription box is your monthly exploration of the many talented artisans creating quality products in Phoenix, AZ."
273,Box,All Seasons Box,Eco & Natural,"Each month we carefully compile 4 luxurious full size seasonal must-have products for your home, body, and spirit that tailor to one season."
274,Box,Mom Memories,Family & Kids,Our child's early years are some of the most important. Busy Moms need to build memories too - and we have found a way to bring them to you.
275,Box,Grizz Essentials,Family & Kids,Grizz loot. One box. Once a month. All the Essentials.
276,Box,A Little Bundle,Family & Kids,"A Little Bundle provides curated bundles of products for both mother and her baby, choosing only the highest quality and design standards."
277,Box,The Connect Box,Family & Kids,"Join the fight against boring family nights! Family activities that encourage healthy, connected relationships with all-in, interactive FUN!"
278,Box,Better Half Box,Food & Artisan Edibles,Better half box offers two thoughtfully curated boxes centered around a new and exciting theme every month. One for Guys and one for Gals.
279,Box,For the Faithful,Family & Kids,"Each month, discover hand-selected items that celebrate your Christian lifestyle."
280,Box,Benko Box,Family & Kids,Inspire creativity & exploration in your child! Benko Box is a monthly art box for kids aged 3 & up. For little kids with big imaginations!
281,Box,CMYFABRIK Box,Art & Culture,Custom fabric + sewing kit + sewing project OR a new sew project (you choose!)
282,Box,The Hair Bow Box,Family & Kids,The Hair Bow Box is a monthly subscription box of handmade boutique quality of Hair Bow and Hair Accessories for girls ages 1-12.
283,Box,Bitsbox,Family & Kids,A free website where kids code apps for real devices. Subscribers get boxes packed with new programming projects every month!
284,Box,Uppercase Box,Family & Kids,Uppercase is a young adult book-of-the-month subscription box. Discover the best new YA books and receive a fun bookish item in every box!
285,Box,Bungalower,Family & Kids,"Join now and get exclusive offers, deals and freebies curated by Bungalower"
286,Box,Pondip,Family & Kids,The latest and greatest fishing tackle delivered to your door every month! Fishing success in a box.
287,Box,Austin Lloyd,Family & Kids,"Austin Lloyd is a monthly box of premium educational toys for children 3 and under, customized to the development stage of your child."
288,Box,Surprise Ride,Family & Kids,"A monthly box of adventure, learning and creativity."
289,Box,Book Ship Lollipop K-2 Subscription Box,Family & Kids,A box of over twenty K-2 hands-on and minds-on inquiry activities designed around the themes of a great children's book every month.
290,Box,Buddy Box,Family & Kids,Finally! A fun and easy way to grow your child’s faith at home! It's a care package for your family's faith.
291,Box,Avery & Austin,Family & Kids,"In each box is everything you need for the perfect playdate. Fun crafts and activities, healthy snacks for two, and a surprise gift for mom."
292,Box,Disney's Park Pack,Family & Kids,Disney's exclusive monthly collectors box
293,Box,Kiwi Crate,Family & Kids,"Each month, we design projects for kids ages 4-8 that inspire creativity and pique curiosity."
294,Box,Bramble Box,Family & Kids,"Fun and learning from our door to yours, every month!"
295,Box,Mystery Tackle Box,Just for Men,Mystery Tackle Box helps fisherman discover new fishing lures and learn new techniques every month.
296,Box,Cooper & Kids,Family & Kids,Cooper Kit – The instant 'Dad is awesome' box.
297,Box,Bundles of Joy,Family & Kids,Bundles of Joy is a curated subscription box meaning every Bundle is picked especially for your little one and is one of a kind!
298,Box,Three Little Crafts,Family & Kids,Join the TLC Community - we’ll deliver 3 craft projects every month. We do the work so you can spend quality one-on-one time with your kids.
299,Box,Citrus Lane,Family & Kids,Get a surprise box of the best products for your child every month
300,Box,Bluum Box,Family & Kids,Discover a monthly box of new goodies for mom & baby.
301,Box,Pro Wrestling Loot,Nerd & Novelty,"Pro Wrestling Goodies EACH and every month. You will receive merchandise ranging from DVD's, T-Shirts, Action Figures & MUCH MORE!"
302,Box,Space Scouts,Family & Kids,A delightful learning adventured aimed at discovering the wonders of the universe!
303,Box,Hoppi Box,Family & Kids,Quarterly deliveries of expert-curated toys that are tailored to your little one’s developmental milestones.
304,Box,The Mommy Team,Family & Kids,"Provides new parents with newborn clothes, blankets and other essentials, as well as right sized clothes and accessories as the baby grows."
305,Box,Junior Explorers,Family & Kids,Junior Explorers is a subscription for kids that teaches them about wildlife and nature through adventures sent home and continued online!
306,Box,MasterMomz Box,Family & Kids,MasterMomz Box is the # 1 Baby & Mommiez Box full of Love!
307,Box,Brit & Co Brit Kits,Art & Culture,Make beautiful and simple DIY projects and recipes that add creativity to your everyday life.
308,Box,For The Makers,Art & Culture,For The Makers is a runway inspired DIY subscription box. Every month they send you all the materials and tutorials you need to make four different DIY projects.
309,Box,Prospurly,Food & Artisan Edibles,"An artisanal monthly subscription crafted for mind, body and soul."
310,Box,Carolina Monthly,Food & Artisan Edibles,"Monthly subscription service of Carolina goodness, hand-picked with you in mind."
311,Box,MOD in a Box,Family & Kids,Get three awesome do-it-yourself projects delivered to your door every month.
312,Box,Our Little Roots,Family & Kids,"Let your child explore nature at its finest, starting from a single seed."
313,Box,21 Bundles,Family & Kids,"We deliver monthly bundles of natural products to pregnant and new Moms, tailored to their stage of pregnancy or their baby's age."
314,Box,Faithbox,Family & Kids,"A monthly box of inspirational quotes & scripture, actions to enrich your Christian life, and curated products from companies with positive missions that we believe in."
315,Box,Teens Turning Green Conscious Collection,Eco & Natural,"The Conscious Collections highlight thoughtfully curated, ethically-produced products across many lifestyle categories."
316,Box,ElementaryBox,Family & Kids,"The teacher care package, because teachers take care of so much! Teaching resources, student rewards, and teacher gifts delivered monthly."
317,Box,Spangler Science Club,Family & Kids,Ignite the spark of science with a subscription to the Spangler Science Club. Receive the coolest hands-on science experiments every month.
318,Box,Bethany Beach Books,Family & Kids,Get a hand-picked book dropped on your doorstep every month.
319,Box,BRICKBOX,Family & Kids,"BRICKBOX Club is a Monthly Mystery Subscription service FILLED with authentic BRICKS and Cool Minifigures, Delivered to your door!"
320,Box,My Princess Box,Family & Kids,My Princess Box is an exciting monthly subscription box for girls who love fashion and love to dress like their dolls!
321,Box,Crazy Kawaii Surprises,Art & Culture,"Monthly Subscription Box with Tokyo Kawaii fashion style. Included Jewelry, Bag, and other accessories with cute, fancy, sweet and dreamin!"
322,Box,PitterPat Packages,Family & Kids,A complete date night delivered to your door. We bring date night to you. No sitter required!
323,Box,Cool New Box,Nerd & Novelty,Bigger and Better than those other guys! Collectibles and toys for adults!
324,Box,The Disc Golf Box Company,Fitness & Health,Let us put together a customized Box of Disc Golf Awesomeness loaded with Contributions from Retailers all across the country just for you.
325,Box,bocandy,Food & Artisan Edibles,Bocandy is an International Candy Subscription Box. We handpick the treats from around the world and mail 6-9 items to you every month!
326,Box,SillyBox,Family & Kids,"Non-profit organization that provides books, toys and other necessities to foster care children through monthly subscription boxes!"
327,Box,toothbrushbyMAIL,Family & Kids,"Toothbrush subscription service. ToothbrushbyMail.com -select one of our great toothbrush, and we send them right to your door every month."
328,Box,The Sweetie People,Food & Artisan Edibles,"Each month we send you a mystery box filled to the brim with candy surprises, 10 - 12 products in each box."
329,Box,Biblio-Box,Nerd & Novelty,Biblio-Box is a book lover's subscription box!
330,Box,YOUR Toy Box,Nerd & Novelty,"You will be able to choose from over 100 categories, insuring that YOUR box is completely one of a kind and original to YOU."
331,Box,Pipsticks,Art & Culture,Pipsticks sends an awesome pack of curated stickers from suppliers around the world to our subscribers every month. Sticker lovers unite!
332,Box,Callinote,Family & Kids,Girls Self Esteem Peaks at age 9. Callinote is here to change that.
333,Box,ilybox,Family & Kids,"Monthly box of hope, love & inspiration through ilycards, challenges & products. For every box purchased, one is given to someone in need."
334,Box,BaptuBox,Family & Kids,"A monthly art, craft and science based subscription box for 5-8 year kids. Designed to nurture the child's curiosity and creativity."
335,Box,bookroo,Family & Kids,bookroo sends books to mommys and daddys looking to spend quality time reading with their little ones.
336,Box,Kuplin Kreations,Family & Kids,The perfect subscription for the planner of any level! Amazing and fun planner goods delivered right to your door!
337,Box,Old Well Craft Supply,Family & Kids,Bring smiles to your doorstep every month.
338,Box,The Fan Empire,Nerd & Novelty,Prepare to have your breath taken away from you faster than Expelliarmus! The Fan Empire is a monthly fandom subscription box service.
339,Box,Be Our Guest Box,Family & Kids,This Ultimate New Disney Inspired subscription features products from Disney Parks and Resorts.
340,Box,SoulFeed College Care Packages,Family & Kids,"Monthly college care package the feeds the body AND soul with gourmet snacks, practical dorm-life items, and weekly faith-based reflections."
341,Box,Paleo Life Box,Fitness & Health,Paleo Life Box is a monthly box of paleo snacks! Each month we'll send you 8 to 10 snacks hand-picked from the best companies on the planet.
342,Box,Yogi Surprise Lifestyle Box,Eco & Natural,A yoga inspired monthly delivery designed to complement your active lifestyle of vitality and growth
343,Box,Grapplers Tool Box,Fitness & Health,"Martial Arts essentials delivered to your door each month- no fuss, no muss. You can focus on doing what you love- training!"
344,Box,Moon Magic Box,Eco & Natural,"The Moon Magic Box is a collection of treasures, gifts and surprises that aid in tuning and energizing your body, mind and spirit!"
345,Box,Dotbox,Just for Women,A Box for whatever mother nature throws at you. Period. All your menstrual needs delivered straight to your front door every month.
346,Box,Bulu Box,Fitness & Health,A Monthly Box of Healthy Discoveries That Will Upgrade Your Health
347,Box,Pondip,Family & Kids,The latest and greatest fishing tackle delivered to your door every month! Fishing success in a box.
348,Box,gain[z] box,Fitness & Health,"Every month you'll get a different mix of things like workout apparel, supplements, gear, equipment, and other suprises to delight you."
349,Box,Bestowed,Fitness & Health,"The best healthy snacks, beverages, and lifestyle items straight to your door."
350,Box,Spa Heroes,Beauty & Fashion,"The simplest way to safer skincare. Spa Heroes delivers non-toxic beauty to your door, one 'Hero Product' at a time. Use Less. Love More."
351,Box,Fit Snack,Fitness & Health,Fuel your active lifestyle with delicious snacks made just for you.
352,Box,Loose Tea Addict,Food & Artisan Edibles,Would you like to try premium loose leaf teas without the hassle of paying big name tea prices? Then our monthly box is for you! Join now!
353,Box,Mystery Tackle Box,Just for Men,Mystery Tackle Box helps fisherman discover new fishing lures and learn new techniques every month.
354,Box,BetterBox,Fitness & Health,Get a collection of joyful activities to shape your very best life from the inside out.
355,Box,Green Blender,Fitness & Health,"Smoothie Recipes, Superfood Ingredients. Delivered Weekly."
