image_num,format,name,category,description
356,Box,Good Habit Box,Food & Artisan Edibles,"Support your health goals with morning and afternoon nutrition, including superfood breakfasts, better-for-you snacks and award-winning teas."
357,Box,Backpacker Box,Food & Artisan Edibles,"BackpackerBox provides subscribers with a slice of the outdoors through delicious snacks and meals, quality gear and backpacking literature"
358,Box,PrettyFit,Fitness & Health,"Each month, we assemble a box of the best nutritional supplements, healthy snacks, workout gear and more, chosen by top fitness professionals."
359,Box,Her Fitness Box,Fitness & Health,Her Fitness Box is a monthly wellness and fitness subscription. Helping you stay on track with your fitness goals.
360,Box,Stashbox,Nerd & Novelty,Get high-end smoking gear delivered to your door monthly.
361,Box,JackedPack,Just for Men,"Be the first to try new supplements, bulk up and become a body building machine!"
362,Box,Pijon Box,Food & Artisan Edibles,"Delicious and healthy snacks, health and beauty supplies, household essentials, and fun gifts for college students."
363,Box,Best Kept Rx,Just for Women,"Put your self-care on autopilot with a dose of Best Kept Rx - Practical products for busy women, delivered to doorsteps four times a year."
364,Box,Fabletics,Fitness & Health,"High-quality, stylish athletic wear co-founded by Kate Hudson and designed for great fit and function."
365,Box,Cosmina,Fitness & Health,Your monthly subscription to activewear! We match your style choices with unique workout outfits -and donate $1 to cleanwater.org per box
366,Box,Disc 2 Door,Fitness & Health,Bringing disc golf to the masses
367,Box,Red Wolves Essentials,Nerd & Novelty,The best part about Red Wolves Essentials is every item is hand picked for Red Wolves fans by Red Wolves fans. We won't put anything in your box that we wouldn't want for ourselves.
368,Box,Athletic Foodie,Food & Artisan Edibles,"All-natural snacks, for athletes, that are designed by a sports dietitian team, to help athletes perform at their best."
369,Box,Strength Crate,Fitness & Health,"Our passion is fitness. Our subscription box sends you the fitness essentials. Equipment, Supplements, Apparel, Training Aids sent to you, Monthly!"
370,Box,Campbox Company,Fitness & Health,We curate camping & hiking gear based on seasonal weather. Our goal is keeping you prepared anytime adventure calls.
371,Box,calmbox,Eco & Natural,"A monthly box helping inspire positivity, peace, and calm in your everyday life."
372,Box,The BJJ Box,Fitness & Health,We wanted a monthly bjj box & there was no such thing. So we made one. Now here we are packing boxes each month for you savages!
373,Box,MyLadyBug,Just for Women,"A monthly period subscription service that deliver your monthly products direct to your door, just when you need it the most."
374,Box,The Disc Golf Box Company,Fitness & Health,Let us put together a customized Box of Disc Golf Awesomeness loaded with Contributions from Retailers all across the country just for you.
375,Box,Muscle Box,Fitness & Health,"The ultimate Bodybuilding & Fitness subscription box that will get you MOTIVATED. Apparel, Supplements, Workouts/Tips, Gym Foods & Goodies."
376,Box,toothbrushbyMAIL,Family & Kids,"Toothbrush subscription service. ToothbrushbyMail.com -select one of our great toothbrush, and we send them right to your door every month."
377,Box,Element Performance Club,Fitness & Health,Top-Quality Health Supplement Home Delivery; Nutritionist- Preferred
378,Box,Spark Box,Fitness & Health,"The exciting relationship you wanted doesn't have to be a dream.We found your spark, now get it back. Keep it fun, with the same partner."
379,Box,KrakBox,Fitness & Health,"Every 2 months, receive an awesome mix of skateboarding gear, apparel & culture, right to your doorstep!"
380,Box,Dollar Diabetic Supply,Fitness & Health,"Drop the overpriced test strips. DDS provides members with diabetes supplies, delivered right to their door, at a fraction of the cost."
381,Box,Foxy Boxes,Fitness & Health,"Each month, as a member, you will receive a box loaded with supplements, healthy snacks, accessories and nutrition products."
382,Box,Nature's Bites,Food & Artisan Edibles,"Nature's Bites delivers wholesome, nutritious and delicious snack goodness"
383,Box,Soleaus,Fitness & Health,"Soleaus™ is the first dietary aid with proven long-term weight loss, without stimulants or fillers."
384,Box,BroteinBox,Fitness & Health,BroteinBox deliver high-protein snacks to your door every month.
385,Box,All Things Needed,Just for Women,Get samples created for women and provided by women delivered right to your door every month!
386,Box,Burst Box,Fitness & Health,The ultimate subscripton box for crossfitters and athletes! We want to make your workouts the best they can be!
387,Box,Art & Soul Box,Art & Culture,"Taking time for art is good for your soul! Each month, receive a new art project, a writing journal, and ideas to spark your creativity."
388,Box,The BuckBin,Art & Culture,A Social subscription that gets the party started. New and innovative items that take your weekend to the next level.
389,Box,Avalai,Just for Women,"Avalai is a monthly subscription service for your period. It includes all the feminine hygiene supplies you need, and the goodies you want."
390,Box,prtnbox,Fitness & Health,"Enjoy protein-packed snacks and samples sent to your door, monthly!"
391,Box,MoonBox by Gaia Collective,Eco & Natural,Deepen your connection with a MoonBox subscription.
392,Box,The NoMoo Box,Food & Artisan Edibles,A monthly box of dairy free goodness.
393,Box,Student Velocity,Eco & Natural,"Subscription box service for Canadian students. Get delicious snacks, and exciting gifts right to your dorm, apartment, or home!"
394,Box,Kuplin Kreations,Family & Kids,The perfect subscription for the planner of any level! Amazing and fun planner goods delivered right to your door!
395,Box,Prepper Gear Box,Fitness & Health,A new monthly subscription box service for those who like survival gear and education. Save 10% off your first box with code: CRATE10
396,Box,WODBOM,Fitness & Health,"A monthly subscription box that supplies CrossFit gear, apparel and healthy snacks to your front door so you can crush your next WOD!"
397,Box,Skoshbox,Food & Artisan Edibles,"Exciting hand-picked Japanese candies, delivered monthly. All plans ship FREE in the US!"
398,Box,Go Local Box,Food & Artisan Edibles,"Discover new favorites while supporting small, local businesses with a box of Louisville goodness every month!"
399,Box,GHOST Spice Supply,Food & Artisan Edibles,GHOST Spice Supply is a monthly spice subscription service with a mission of turning novice home cooks into confident home chefs.
400,Box,SnackFever,Food & Artisan Edibles,Discover delicious Korean snacks in a monthly box at your door for under $20.
401,Box,FlavourCrate,Food & Artisan Edibles,"Discover Australia's finest gourmet ingredients, foods and snacks. Delivered to your door each month nationwide - Be a better foodie."
402,Box,Randocrate,Art & Culture,"Random, excellet and unique delivered to your door once a month."
403,Box,French Box,Art & Culture,A trendy piece of France in a box
404,Box,Better Half Box,Food & Artisan Edibles,Better half box offers two thoughtfully curated boxes centered around a new and exciting theme every month. One for Guys and one for Gals.
405,Box,Hello Fresh,Food & Artisan Edibles,We deliver delicious and healthy recipes with all the pre-measured ingredients to your door each week.
406,Box,Hammock Pack,Art & Culture,Take a much needed getaway without even leaving your home.
407,Box,Cupcake Dazzle,Food & Artisan Edibles,Cupcake Dazzle is a monthly subscription box where you receive everything you need to decorate sweet treats right to your door!
408,Box,Graze,Food & Artisan Edibles,"Don't just snack, Graze!"
409,Box,Nibblr,Food & Artisan Edibles,Crave-worthy snacks delivered to your office or home
410,Box,Paleo Life Box,Fitness & Health,Paleo Life Box is a monthly box of paleo snacks! Each month we'll send you 8 to 10 snacks hand-picked from the best companies on the planet.
411,Box,Love With Food,Food & Artisan Edibles,"Snack Smart. Do Good. For every box sent, we donate a meal to a hungry child."
412,Box,Nomad Coffee Club,Food & Artisan Edibles,A coffee subscription for you daily fix. We deliver to your door and add convenience to your life.
413,Box,Yogi Surprise Lifestyle Box,Eco & Natural,A yoga inspired monthly delivery designed to complement your active lifestyle of vitality and growth
414,Box,Nature Box,Food & Artisan Edibles,"Every month, get five full-sized packages of great-tasting, nutritionist-approved snacks."
415,Box,Mitten Crate,Food & Artisan Edibles,"Mitten Crate takes the guesswork out of discovering unique, great tasting, Michigan products."
416,Box,Quarterly Co,Art & Culture,A quarterly subscription service providing direct access to your favorite celebrity and popular social icons.
417,Box,Treatsie,Food & Artisan Edibles,Treat yourself or someone special to delicious gourmet sweets starting at just $12 per month.
418,Box,PeachDish,Food & Artisan Edibles,Reconnect with the pleasures of cooking: Southern-infused & internationally-inspired meals shipped to your door.
419,Box,Joe's Brew Club,Food & Artisan Edibles,"Freshly roasted gourmet coffee paired with varieties of biscotti and premium chocolates! Flavors change monthly, always an amazing brew!"
420,Box,Plated,Food & Artisan Edibles,"A weekly box of fresh and seasonal ingredients, pre-portioned for the recipes you choose, so you can create great food with less effort."
421,Box,SumoJerky,Food & Artisan Edibles,Craft beef jerky delivered to your mailbox.
422,Box,Hazel Lane,Art & Culture,"The BEST OF locally produced organic, eco-chic, hipster goods from a new US locale. Destination subscription box and online a la carte Shop"
423,Box,The Tasteful Pantry Treat Box,Food & Artisan Edibles,"The only monthly box out there that offers customization for dietary restrictions paired with natural, wholesome snacks & sweets."
424,Box,The Austin BatBox,Food & Artisan Edibles,
425,Box,Door Bean,Food & Artisan Edibles,Door Bean delivers the World's Finest Coffee to your home or business every month. Give us a try - you will love our coffee.
426,Box,Taste Guru,Food & Artisan Edibles,"Every month Taste Guru brings you delicious gluten-free options, helping you explore the tastier side of healthy."
427,Box,OmNomBox,Food & Artisan Edibles,"Yummy snacks from across Asia, specially prepared to surprise you every month!"
428,Box,Box O' Munch,Food & Artisan Edibles,Hungry? Need some munch? Get a box filled to the brim with munchies delivered to your doorstep monthly!
429,Box,Fixed Foods,Food & Artisan Edibles,"Fresh, healthy, expertly-prepared paleo meals delivered to your home or office."
430,Box,Batch USA,Food & Artisan Edibles,"The Batch team hand selects products for every subscription and gift box we sell. From Nashville to Memphis to Charleston, we bring you the best of local."
431,Box,Bungalower,Family & Kids,"Join now and get exclusive offers, deals and freebies curated by Bungalower"
432,Box,Exotic Noods,Food & Artisan Edibles,"Specialty noodles on autopilot. Discover the best, most exotic noodles on the planet, every month."
433,Box,Jerky Break,Food & Artisan Edibles,Healthy beef jerky delivered to you monthly.
434,Box,Hamptons Lane,Food & Artisan Edibles,"Curated artisan ingredients, handy kitchen tools, with unique recipes delivered in a monthly themed box."
435,Box,Bean Box,Food & Artisan Edibles,"Seattle’s finest artisan coffee, delivered fresh."
436,Box,The Tasteful Pantry Low Carb Box,Food & Artisan Edibles,Titillate your taste buds while staying true to your healthy lifestyle!
437,Box,Simple Loose Leaf Tea,Food & Artisan Edibles,We offer a box that features 4-6 unique loose leaf teas and other tea accessories each month. Plus our members get 50% off tea at our Shop.
438,Box,Anime Bento,Nerd & Novelty,"We pack each month's bento with great anime trading figures, accessories, and delicious snacks from Japan."
439,Box,ZampleBox,Food & Artisan Edibles,A delicious assortment of the best e juices delivered monthly. Less than $1/day. Vaping made easy.
440,Box,The Whisky Order,Food & Artisan Edibles,We'll send you up to five 30ml hand poured (read generously poured) whisky samples every month. You drink and enjoy - we do the rest.
441,Box,Bespoke Post,Food & Artisan Edibles,"Bespoke Post is a monthly subscription that delivers small-batch, artisan-crafted products for the everyday man. Unique Lifestyle Products for Men. In a Monthly Themed Box of Awesome."
442,Box,Bestowed,Fitness & Health,"The best healthy snacks, beverages, and lifestyle items straight to your door."
443,Box,MunchPak,Food & Artisan Edibles,New and popular snacks from around the world.
444,Box,UrthBox,Eco & Natural,"A monthly collection of healthy snacks, beverages and more!"
445,Box,Lick My Dip,Food & Artisan Edibles,"Lick My Dip delivers the best of British Hot Sauces, fiery snacks and ingredients to your door every month."
446,Box,Fit Snack,Fitness & Health,Fuel your active lifestyle with delicious snacks made just for you.
447,Box,A Kitchen Box,Food & Artisan Edibles,Kitchen inspiration delivered to your door. A monthly subscription to awaken your senses and start having fun in the kitchen again!
448,Box,Keto Krate,Food & Artisan Edibles,"We find the best Keto snacks, load them into a box and send it to your home."
449,Box,Hustle & Grind Co.,Food & Artisan Edibles,"A monthly box of coffee, hustler swag, epic gear and more!"
450,Box,Loose Tea Addict,Food & Artisan Edibles,Would you like to try premium loose leaf teas without the hassle of paying big name tea prices? Then our monthly box is for you! Join now!
451,Box,Orange Glad,Food & Artisan Edibles,"We discover, carefully curate a box of gourmet sweets and deliver it to your door every month."
452,Box,Send Me Gluten Free,Food & Artisan Edibles,A monthly surprise of the best gluten-free products delivered straight to your door
453,Box,The Gin Crowd,Just for Men,Get handpicked craft gin delivered every month.
454,Box,SnackSack,Food & Artisan Edibles,"We aren't a box, we're a sack...stuffed FULL of tasty and delicious, but healthier snacking options."
455,Box,Plum Deluxe Tea,Food & Artisan Edibles,"Signup & enjoy a limited-edition artisan tea each month, carefully crafted with only the freshest organic ingredients infused with love."
456,Box,My Texas Market,Food & Artisan Edibles,Bringing the farmer's market to your doorstep.
457,Box,Num-Nums Munch Box,Food & Artisan Edibles,"""Box-of-the-Month club for allergy-conscious or vegan snacks. Each month we will ship a box full of hand-picked goodies right to your door!"""
458,Box,Green Blender,Fitness & Health,"Smoothie Recipes, Superfood Ingredients. Delivered Weekly."
459,Box,The Devotea USA Tea of the Month,Food & Artisan Edibles,"A monthly box with 3 different loose leaf teas. We strive to offer you selections from our core blends, unique finds and single origins."
460,Box,The GlobeIn Artisan Box,Eco & Natural,The GlobeIn Artisan Box is the smartest way to discover mindful food and lifestyle products from around the world.
461,Box,Okie Goodies Box,Food & Artisan Edibles,"A themed box for food grown, mixed, or made in Oklahoma by small businesses, with a specialty subscription devoted only to artisan fudge!"
462,Box,Freshly Ready-Made Meals,Food & Artisan Edibles,Gourmet ready-made meals delivered to your door.
463,Box,Try The World,Food & Artisan Edibles,A gourmet box from a new country every 2 months
464,Box,Taste Trunk,Food & Artisan Edibles,"Distinctive gourmet gifts, delivered to your door"
465,Box,Candy Club,Food & Artisan Edibles,A monthly box of your favorite candies delivered to your doorstep.
466,Box,SporkPack,Food & Artisan Edibles,Flavor profiles to surprise the pallet and unique textures that tantalize the tongue.
467,Box,Good Habit Box,Food & Artisan Edibles,"Support your health goals with morning and afternoon nutrition, including superfood breakfasts, better-for-you snacks and award-winning teas."
468,Box,RawSpiceBar,Food & Artisan Edibles,"Global, authentic spice blends created by top chefs. Direct to your door every month."
469,Box,Sriracha Box,Food & Artisan Edibles,Sriracha Box fuels your sriracha fire with monthly deliveries of sriracha goodness
470,Box,Healthy Surprise,Food & Artisan Edibles,Discover your new favorite guilt free treats.
471,Box,Hatchery Tasting Box,Food & Artisan Edibles,Receive a curated delivery of sample-size ingredients and condiments from our Marketplace each month.
472,Box,Backpacker Box,Food & Artisan Edibles,"BackpackerBox provides subscribers with a slice of the outdoors through delicious snacks and meals, quality gear and backpacking literature"
473,Box,Monthly Pepper Box,Food & Artisan Edibles,"Monthly Pepper Box finds artisan hot sauce makers and features the sauces that make their brand unique. A box of face melt, every month."
474,Box,Universal Yums,Food & Artisan Edibles,Snacks from a different country delivered monthly.
475,Box,Candy Box,Food & Artisan Edibles,Monthly box of curated full size candy from the US/UK/Canada.
476,Box,Pijon Box,Food & Artisan Edibles,"Delicious and healthy snacks, health and beauty supplies, household essentials, and fun gifts for college students."
477,Box,Hawaii Snack Box,Food & Artisan Edibles,We send you a taste of the islands every month in our snack box! Enroll today for your fly-free ticket to paradise!
478,Box,Urban Organic Gardener,Eco & Natural,Get a unique collection of garden seeds delivered to you every month -- At the right time to plant them -- Specially selected just for you.
479,Box,Prep Dish,Food & Artisan Edibles,"Shop once, prep once, eat healthy, stress-free meals all week!"
480,Box,Cheese of the Month,Food & Artisan Edibles,"Savor traditionally made cheeses from around the world, and discover an enormous range of tastes, aromas, textures, and ways to serves and use each cheese."
481,Box,Farm Fresh To You,Food & Artisan Edibles,Organic fruits and vegetables delivered fresh from our farm to your doorstep.
482,Box,Noble Brewer,Food & Artisan Edibles,"Fantastic box of 4 22oz. bottles of homebrewer-inspired craft beer, delivered to your door quarterly."
483,Box,Blue Apron,Food & Artisan Edibles,Say goodbye to grocery shopping with gourmet recipes delivered weekly to your home.
484,Box,the Oatmail Club,Food & Artisan Edibles,Gluten free Baking and Breakfast goods delivered to your door monthly for as little as $1 per day.
485,Box,War Foodie,Food & Artisan Edibles,A monthly food subscription seeking to radically reinvent care packages to our military and expat communities.
486,Box,Athletic Foodie,Food & Artisan Edibles,"All-natural snacks, for athletes, that are designed by a sports dietitian team, to help athletes perform at their best."
487,Box,Fuego Box,Food & Artisan Edibles,A hot sauce of the month club focused on craft and small batch hot sauces. Join to get the best hot sauces you've probably never heard of.
488,Box,Prospurly,Food & Artisan Edibles,"An artisanal monthly subscription crafted for mind, body and soul."
489,Box,Carolina Monthly,Food & Artisan Edibles,"Monthly subscription service of Carolina goodness, hand-picked with you in mind."
490,Box,Rain City Box,Food & Artisan Edibles,"Rain City Box provides you with a monthly box of the hippest, most buzzworthy products from Seattle and the surrounding Pacific Northwest!"
491,Box,Bedouin Box,Food & Artisan Edibles,Get a monthly surprise box of the Middle East's freshest roasted Coffee and local infusion Teas. The Bedouin Box ships worldwide.
492,Box,Oat Box,Food & Artisan Edibles,Healthy and original breakfast cereals delivered to your door every month.
493,Box,The B-More Box,Food & Artisan Edibles,"Every month members receive a different variety of hand selected local food, regional art, and awesome products."
494,Box,Company's Comin',Food & Artisan Edibles,"Casseroles, Soups, Dips, and Cheese Balls delivered to you monthly"
495,Box,BoxDetox,Eco & Natural,"BoxDetox is the only detox discovery box with happiness, health and fitness as core components."
496,Box,Healthy Foodie Box,Food & Artisan Edibles,"Healthy Foodie Box discover, curate and deliver quality healthy snacks to your door."
497,Box,SnackNation,Food & Artisan Edibles,"An easy, hassle-free way to get delicious healthy snacks delivered right to your office."
498,Box,Teens Turning Green Conscious Collection,Eco & Natural,"The Conscious Collections highlight thoughtfully curated, ethically-produced products across many lifestyle categories."
499,Box,Coffee Crate,Food & Artisan Edibles,"Every month, you will receive three 4oz packages of NC roasted coffee. Try 36 different NC roasters over the course of a year."
500,Box,Campbox Company,Fitness & Health,We curate camping & hiking gear based on seasonal weather. Our goal is keeping you prepared anytime adventure calls.
501,Box,Jerky Snob,Food & Artisan Edibles,"Delicious premium jerky delivered to your home or office. We only feature healthy jerky that is free of MSG, Nitrates, Nitrites, and HFCS."
502,Box,Curry Delights,Food & Artisan Edibles,Cook up a spendid Indian feast in the comfort of your own kitchen.
503,Box,fruitkit - Fruit on Autopilot,Food & Artisan Edibles,"Fresh fruit on autopilot. Creating a new service model to give Finns access to the freshest, tastiest fruit, year-round, for a flat fee."
504,Box,nourissh,Food & Artisan Edibles,"Using local & organic ingredients. Because when you eat better, you feel better."
505,Box,The Ramen Box,Food & Artisan Edibles,"When you sign up for The Ramen Box, every 2 month you will receive a box of carefully curated ramen and a special present."
506,Box,Edmond's Cuisine,Food & Artisan Edibles,"Every month, experience the world through authentic food."
507,Box,Hardy Coffee Co,Food & Artisan Edibles,"The best coffees in the world, in the most down-to-earth way possible."
508,Box,My BBQ Box,Food & Artisan Edibles,"Become a BBQ pro. Get the rub, the guide and a special surprise every month. We even throw in an extra bottle of rub for a buddy"
509,Box,Harvest,Food & Artisan Edibles,Quarterly harvest delivered to your door. Enjoy the finest wine country has to offer each season.
510,Box,The Happy Crate,Nerd & Novelty,The cure for boredom when you're stoned.
511,Box,bocandy,Food & Artisan Edibles,Bocandy is an International Candy Subscription Box. We handpick the treats from around the world and mail 6-9 items to you every month!
512,Box,The Sweetie People,Food & Artisan Edibles,"Each month we send you a mystery box filled to the brim with candy surprises, 10 - 12 products in each box."
513,Box,Hey Gluten Free,Food & Artisan Edibles,Get delicious gluten-free goodies delivered to your door monthly!
514,Box,Foxy Boxes,Fitness & Health,"Each month, as a member, you will receive a box loaded with supplements, healthy snacks, accessories and nutrition products."
515,Box,Cuisine Cube,Food & Artisan Edibles,"Artisan foods from awesome independent brands, delivered monthly."
516,Box,The Brooklyn Box,Food & Artisan Edibles,"A box filled with the best artisan products from the best place on earth, Brooklyn, NY, delivered to your door!"
517,Box,Bakes,Food & Artisan Edibles,A MONTHLY BOX CONTAINING A RECIPE AND THE INGREDIENTS NEEDED TO BAKE IT.
518,Box,Nature's Bites,Food & Artisan Edibles,"Nature's Bites delivers wholesome, nutritious and delicious snack goodness"
519,Box,BroteinBox,Fitness & Health,BroteinBox deliver high-protein snacks to your door every month.
520,Box,Boxtera,Food & Artisan Edibles,"Our natural Boxtera snacks satisfy all the tastes of your gustatory perception; savory, sweet, sour, bitter and salty!"
521,Box,Chef Tools,Food & Artisan Edibles,"Providing chef tools to professional chefs, apprentice chefs, student chefs, aspiring culinary enthusiasts of every kind."
522,Box,Local Lovin Utah,Food & Artisan Edibles,Local Lovin’ aims to support and strengthen the local community and economy by promoting locally owned businesses throughout Utah.
523,Box,Hot Sauce Club,Food & Artisan Edibles,"Raising the profile of UK chilli producers. Receive a box of fiery hot sauces, jams, chutneys and chocolates delivered to your door."
524,Box,Okie Goodies O! Fudge,Food & Artisan Edibles,"Discover the smooth, creamy deliciousness of small batch artisan fudge made fresh in Bethany, Oklahoma."
525,Box,Bakers Krate,Food & Artisan Edibles,"Gourmet, artisan baked goods delivered straight to your door every month."
526,Box,Very Portland,Food & Artisan Edibles,"Ironically made in Portland, we're the monthly subscription service featuring the best local artisans in our city."
527,Box,Irie Mon Box,Food & Artisan Edibles,"Monthly Subscription Box with spices, snacks, fire, fashion and good vibes from the Caribbean. Everyting Irie Mon!"
528,Box,prtnbox,Fitness & Health,"Enjoy protein-packed snacks and samples sent to your door, monthly!"
529,Box,Aloha Crate,Food & Artisan Edibles,"When you sign up for Aloha Crate, every month you will receive a box of carefully selected Hawaii snacks."
530,Box,The NoMoo Box,Food & Artisan Edibles,A monthly box of dairy free goodness.
531,Box,Community Supported Chocolate,Food & Artisan Edibles,This subscription features a mouthwatering assortment of chocolates crafted to nourish the mind & invigorate the senses on a monthly basis.
532,Box,Kitchen Table Passport,Food & Artisan Edibles,The next best thing to a plane ticket! Gather your friends or family every month and explore a different country with all 5 of your senses.
