image_num,format,name,category,description
1,Box,BarkBox,Animals & Pets,"BarkBox is a monthly surprise of dog toys, treats, and goodies! Subscribe to BarkBox for your pup - or give BarkBox as the perfect dog gift."
2,Box,Randocrate,Art & Culture,"Random, excellet and unique delivered to your door once a month."
3,Box,PupJoy,Animals & Pets,"A monthly box of bliss for your dog. Customized ordering, concierge service and artisan products from socially conscious companies."
4,Box,The Binky Bundle by The Bunny Chick,Animals & Pets,The Binky Bundle is the first and only subscription box in the US for your pet bunny rabbits.
5,Box,PetBox,Animals & Pets,"Enjoy a mix of healthy treats, toys, and accessories for your dog or cat each month."
6,Box,Surprise My Pet,Animals & Pets,"Surprise My Pet is for dog lovers! Each box includes tasty treats, fun toys, bones and other exciting goodies!"
7,Box,ChewChest,Animals & Pets,"A monthly box for dogs that like to rip, chew and shred! Durable toys, chews, treats and more delivered to your door every month!"
8,Box,Adventurous Paw,Animals & Pets,"A themed monthly dog treat subscription service, a customized box of dog treats, accessories & complimentary gifts for you & your loyal pet."
9,Box,KitNipBox,Animals & Pets,"Each box contains high-quality cat toys, all-natural treats, and other fun, healthy cat products."
10,Box,Pet Giftbox,Animals & Pets,Pet Gift Box is a monthly subscription service that sends a box of hand-selected treats & toys created just for cats & dogs. Spoil your pet pals!
11,Box,PawPack,Animals & Pets,An assortment of healthy and sustainable pet products delivered monthly.
12,Box,Bugsy's Box,Animals & Pets,"A monthly box of surprises for your best friend, because they are more than just dogs."
13,Box,Bully Bundles,Animals & Pets,"Bully sticks delivered monthly. High quality, low odor, 6"" bully sticks"
14,Box,Cattitude Club,Animals & Pets,"Cattitude Club is an exclusive club for Aussie cats! Perks include a mystery box of treats, toys and care products every month!"
15,Box,The Disc Golf Box Company,Fitness & Health,Let us put together a customized Box of Disc Golf Awesomeness loaded with Contributions from Retailers all across the country just for you.
16,Box,Happy Bunny Club,Animals & Pets,We aim to surprise and delight with our monthly boxes that contain all-natural toys & treats for your bunny.
17,Box,CatLadyBox,Just for Women,"Unique finds for cat lovers, delivered to your door each month. Get cat-themed jewelry, clothes, accessories, decor, books and more!"
18,Box,Pooch Party Packs,Animals & Pets,We take care in hand-selecting quality toys and treats to your pup. Your only job is to open the box and enjoy the party together!
19,Box,GHOST Spice Supply,Food & Artisan Edibles,GHOST Spice Supply is a monthly spice subscription service with a mission of turning novice home cooks into confident home chefs.
20,Box,Go Local Box,Food & Artisan Edibles,"Discover new favorites while supporting small, local businesses with a box of Louisville goodness every month!"
21,Box,Darby Smart To DIY For Box,Art & Culture,Mystery DIY Kit
22,Box,Cosmo-cube,Nerd & Novelty,"The Cube will consist 4-5 mystery, geeky/nerdy, gaming and pop culture gears along with a T-shirt and Poster that has the winning arts."
23,Box,Randocrate,Art & Culture,"Random, excellet and unique delivered to your door once a month."
24,Box,French Box,Art & Culture,A trendy piece of France in a box
25,Box,Better Half Box,Food & Artisan Edibles,Better half box offers two thoughtfully curated boxes centered around a new and exciting theme every month. One for Guys and one for Gals.
26,Box,Flicker Box,Art & Culture,A variety of artisanal candles made from candle artists in the U.S.A
27,Box,Hammock Pack,Art & Culture,Take a much needed getaway without even leaving your home.
28,Box,MissionCute,Art & Culture,Mission Cute is dedicated to bringing you adorable accessories while contributing to the communities that need it most.
29,Box,The Handy Box,Art & Culture,"Whether you're away at college, looking for the perfect gift, or working on a home project, The Handy Box Subscription Box is a must have for every home."
30,Box,Quarterly Co,Art & Culture,A quarterly subscription service providing direct access to your favorite celebrity and popular social icons.
31,Box,Hazel Lane,Art & Culture,"The BEST OF locally produced organic, eco-chic, hipster goods from a new US locale. Destination subscription box and online a la carte Shop"
32,Box,The Austin BatBox,Food & Artisan Edibles,
33,Box,CMYFABRIK Box,Art & Culture,Custom fabric + sewing kit + sewing project OR a new sew project (you choose!)
34,Box,Landfall Freight Co.,Nerd & Novelty,Monthly new graphic novel and comics featuring cool female stories along with artsy goodies and inspiration! Make landfall in another world!
35,Box,Fiberista Club,Art & Culture,Fiberista Club delivers the best yard and spinning fiber to your doorstep every month in high customizable packages.
36,Box,HorrorDervs,Nerd & Novelty,"We are an affordable mini monthly subscription offering horror themed items such as candy, memorabilia, and custom hand made collectibles."
37,Box,PostStitch,Art & Culture,PostStitch delivers a monthly knitting project to knitters worldwide. Available in two subscription options: BigStitch and SockStitch.
38,Box,OllieCrate,Art & Culture,Collectible skateboard goods delivered to your front door every month! Monthly subscriptions starting at just $6.
39,Box,Bungalower,Family & Kids,"Join now and get exclusive offers, deals and freebies curated by Bungalower"
40,Box,Messy Box,Art & Culture,A monthly box of awesome products you can use to document your life in style.
41,Box,Happy Mail,Art & Culture,Get $50 worth of stationery at your doorstep for just $15 a month!
42,Box,Hamptons Lane,Food & Artisan Edibles,"Curated artisan ingredients, handy kitchen tools, with unique recipes delivered in a monthly themed box."
43,Box,Fresh Fiction Box Not TO Miss,Nerd & Novelty,"When you sign up for Fresh Fiction Box Not to Miss, you will receive a box with a new release print book, free eBooks and tons of swag."
44,Box,Artisan Box,Art & Culture,Artisan Box is a lifestyle box especially curated with exclusive & handcrafted art & craft of India to help Artisan earn a decent livelihood
45,Box,Anime Bento,Nerd & Novelty,"We pack each month's bento with great anime trading figures, accessories, and delicious snacks from Japan."
46,Box,Kerri's Box O' Scents,Art & Culture,When you sign up to receive a Box O' Scents you will receive a box of carefully selected scents to enjoy for every season.
47,Box,SketchBox,Art & Culture,Every month we send new premium art supplies for you to try along with an inspirational piece of art made with the supplies in the box.
48,Box,FestiDrops,Art & Culture,"FestiDrops is the first active festival themed subscription service. Airdrops each month to your door filled with pins, art, apparel & more!"
49,Box,Festy Box,Art & Culture,A monthly box of festival goodness
50,Box,Axe Packs - Guitar Strings Subscription Service,Art & Culture,A fresh set of strings every month!
51,Box,Loose Tea Addict,Food & Artisan Edibles,Would you like to try premium loose leaf teas without the hassle of paying big name tea prices? Then our monthly box is for you! Join now!
52,Box,Mystical Mojo Box,Eco & Natural,Assisting You In Your Spiritual Journey. Is it time to fill up your spiritual toolbox? Mystical Goodies delivered monthly
53,Box,Wrestle Crate,Nerd & Novelty,Wrestle Crate is a Pro Wrestling themed subscription service. A monthly mystery crate filled with wrestling awesomeness!
54,Box,Protocrate,Nerd & Novelty,"ProtoCrate is a monthly subscription box full of new filament, tools, printed samples and more-- all curated and tested for 3D Printers."
55,Box,Clean Getaway Subscription Box,Nerd & Novelty,"You get a bi-monthly box including soap, new products, and other maker stuff."
56,Box,Nicely Noted,Art & Culture,Nicely Noted is a monthly stationery subscription service that delivers a curated collection of letterpress cards & stamps to your mailbox.
57,Box,Frankie & Albert,Art & Culture,Found objects hand picked for you
58,Box,Brit & Co Brit Kits,Art & Culture,Make beautiful and simple DIY projects and recipes that add creativity to your everyday life.
59,Box,For The Makers,Art & Culture,For The Makers is a runway inspired DIY subscription box. Every month they send you all the materials and tutorials you need to make four different DIY projects.
60,Box,Carolina Monthly,Food & Artisan Edibles,"Monthly subscription service of Carolina goodness, hand-picked with you in mind."
61,Box,Gear Supply Co.,Art & Culture,Subscription guitar strings hand wound in the USA and delivered to your door every month.
62,Box,Prospurly,Food & Artisan Edibles,"An artisanal monthly subscription crafted for mind, body and soul."
63,Box,Rain City Box,Food & Artisan Edibles,"Rain City Box provides you with a monthly box of the hippest, most buzzworthy products from Seattle; and the surrounding Pacific Northwest!"
64,Box,Our Little Roots,Family & Kids,"Let your child explore nature at its finest, starting from a single seed."
65,Box,Faithbox,Family & Kids,"A monthly box of inspirational quotes & scripture, actions to enrich your Christian life, and curated products from companies with positive missions that we believe in."
66,Box,Spinbox,Art & Culture,A monthly record club customized to your preferences in music. Discover Experience Collect
67,Box,Crazy Kawaii Surprises,Art & Culture,"Monthly Subscription Box with Tokyo Kawaii fashion style. Included Jewelry, Bag, and other accessories with cute, fancy, sweet and dreamin!"
68,Box,Quilty Box,Art & Culture,Find new fabric and products and expand your talents! Quilty Box will deliver an inspiring box right to your door every month.
69,Box,The Happy Crate,Nerd & Novelty,The cure for boredom when you're stoned.
70,Box,Decoterie: Monthly Decor Subscription Box,Just for Women,"Home decor box for a cause. Exclusive homewares, decorative accessories; objects of desire curated by Letitia Elizabeth. 10% goes to charity"
71,Box,SillyBox,Family & Kids,"Non-profit organization that provides books, toys and other necessities to foster care children through monthly subscription boxes!"
72,Box,Alaska Cache Box,Art & Culture,A quarterly subscription box of curated items from Alaskan artists and businesses.
73,Box,KrakBox,Fitness & Health,"Every 2 months, receive an awesome mix of skateboarding gear, apparel & culture, right to your doorstep!"
74,Box,The Brooklyn Box,Food & Artisan Edibles,"A box filled with the best artisan products from the best place on earth, Brooklyn, NY, delivered to your door!"
75,Box,The Planner Addict Box,Just for Women,Get handpicked planner supplies delivered every month.
76,Box,Wax & Stamp,Art & Culture,New records to your door every month.
77,Box,Art & Soul Box,Art & Culture,"Taking time for art is good for your soul! Each month, receive a new art project, a writing journal, and ideas to spark your creativity."
78,Box,Chef Tools,Food & Artisan Edibles,"Providing chef tools to professional chefs, apprentice chefs, student chefs, aspiring culinary enthusiasts of every kind."
79,Box,The BuckBin,Art & Culture,A Social subscription that gets the party started. New and innovative items that take your weekend to the next level.
80,Box,Pipsticks,Art & Culture,Pipsticks sends an awesome pack of curated stickers from suppliers around the world to our subscribers every month. Sticker lovers unite!
81,Box,The Music Box,Art & Culture,A New Way To Discover Amazing Music
82,Box,Moustache Stationery,Art & Culture,We scour the earth for the most amazing stationery products. Every month we curate an exclusive box for our subscribers.
83,Box,Skein of the Month Club,Art & Culture,Explore the joyous possibilities when you subscribe to the Skein a Month Club
84,Box,Very Portland,Food & Artisan Edibles,"Ironically made in Portland, we're the monthly subscription service featuring the best local artisans in our city."
85,Box,Paper Goose,Art & Culture,"Coordinated scrapbooking supplies from top rated brands and featured small shops, with enough paper and embellishments to create 4-5 pages."
86,Box,Kitchen Table Passport,Food & Artisan Edibles,The next best thing to a plane ticket! Gather your friends or family every month and explore a different country with all 5 of your senses.
87,Box,CraftyKatie,Art & Culture,A monthly subscription box for arts and crafts lovers filled with hand-made items!
88,Box,Scent Trunk,Nerd & Novelty,Your perfect scents delivered on your schedule
89,Box,My Bakers Box,Food & Artisan Edibles,"A monthly subscription box that will be delivered directly to your door. It will include baking ideas, samples, recipes and more!"
90,Box,Old Well Craft Supply,Family & Kids,Bring smiles to your doorstep every month.
91,Box,The Community Chest,Food & Artisan Edibles,"The Community Chest subscription box is your monthly exploration of the many talented artisans creating quality products in Phoenix, AZ."
92,Box,Rocksbox,Beauty & Fashion,"With Rocksbox, receive a curated box of designer gems you can borrow, buy or swap at any time."
93,Box,Beauteque Monthly,Beauty & Fashion,"This is a monthly subscription bag filled with Asian full-size skincare, cosmetic, and lifestyle items."
94,Box,Better Half Box,Food & Artisan Edibles,Better half box offers two thoughtfully curated boxes centered around a new and exciting theme every month. One for Guys and one for Gals.
95,Box,Golden Tote,Beauty & Fashion,"Ladies, get ready to get hooked on two of your favorite things clothing and surprises!"
96,Box,GlossyBox,Beauty & Fashion,Exclusive cosmetic samples and perfume samples from the best makeup brands online
97,Box,GoodeBox,Eco & Natural,"Expertly curated, healthy, natural and non-toxic beauty products delivered monthly"
98,Box,Bath Time Box,Beauty & Fashion,"Designed and curated with the Bath lover in mind, each Bath Time Box is carefully chosen to take your bath time to the next level."
99,Box,Ipsy,Beauty & Fashion,Sample 4-5 amazing beauty products tailored to you in a collectible bag
100,Box,Julep Maven,Beauty & Fashion,"The beauty box that delivers exactly what you want, every month."
101,Box,DEADSETFRESH monthly box,Beauty & Fashion,A monthly box of trendy clothing & accessories for Aussie guys. It's just $79/month and your box is curated to your personal style.
102,Box,MissionCute,Art & Culture,Mission Cute is dedicated to bringing you adorable accessories while contributing to the communities that need it most.
103,Box,Vegan Cuts Beauty Box,Beauty & Fashion,Discover a variety of cruelty-free beauty brands once a month.
104,Box,Handmade Cartel,Beauty & Fashion,From the makers of theOrganicLoft.com - A lifestyle subscription service specializing in handmade cruelty free products.
105,Box,BareBox,Beauty & Fashion,BareBox delivers incredible organic bath and beauty products every month.
106,Box,Cate & Chloe VIP,Beauty & Fashion,Get Two new pieces of the hottest fashion jewelry delivered to your door every month! It is yours to love and keep forever!
107,Box,Wantable,Beauty & Fashion,Our personal stylists navigate the world of fashion and beauty to bring you the latest trends.
108,Box,Stitch Fix,Beauty & Fashion,"Clothing and accessories hand-selected by a personal stylist, delivered to your door."
109,Box,Beauty Box Five,Beauty & Fashion,"5 deluxe pretty samples that'll make you race to your mailbox, for $12 a month. We're obsessed with making beauty fun again!"
110,Box,Sample Society,Beauty & Fashion,Finding your new favorite products couldn't be easier. Subscribe now for a monthly dose of beauty.
111,Box,International Blessings,Beauty & Fashion,"Unique, beautiful jewelry and products fighting poverty! Handmade by impoverished artisans. 10% donation goes to poverty fighting causes."
112,Box,Box of Style,Just for Women,"Fashion, beauty and lifestyle items you'll be obsessed with."
113,Box,Ozone Sock Club,Beauty & Fashion,Treat your feet each month with a fresh pair of Ozone Socks!
114,Box,Petit Vour,Beauty & Fashion,"Join our monthly beauty box and explore our collections of luxe skincare, makeup, hair care, and more."
115,Box,FabFitFun VIP Box,Just for Women,"Full-size, premium products delivered 4x per year."
116,Box,Root Bizzle: Menswear on Autopilot,Father's Day,"Looking to put your menswear on autopilot? We learn your style preferences to send you the perfect ties and socks, each month."
117,Box,Pip & Lola's Everything Homemade,Beauty & Fashion,"We specialize in ""barely scented all-natural handmade and hand cut soaps. Pick a ONE or TWO bar monthly or 3/6/12 month prepaid soapy box."""
118,Box,The Personal Barber,Just for Men,"The gentleman's monthly shaving subscription, providing top quality traditional shaving goods to keep you loving the morning routine"
119,Box,Style Quarterly,Beauty & Fashion,Style Quarterly delivers products such as Elucx's Rose Milk Bath Soak and Rifle Paper and Co's Travel Journals to our members each season.
120,Box,Sockwork,Beauty & Fashion,"Sock subscription service where customers can customize their orders. We offer men's, women's, and athletic socks and men's boxer briefs."
121,Box,Sudsy Box,Beauty & Fashion,"Luxurious soaps that look amazing, smell awesome and are ALL NATURAL! A bi-monthly soap box with 3 artisan soaps and a luxe body product."
122,Box,The Soap Box Monthly,Beauty & Fashion,"The Soap Box Monthly, receive a box of 4 (2-3oz.) Handmade Soaps PLUS Your Choose Your Bonus Item. New Subscribers get a Free Solid Perfume."
123,Box,Tee Tubes,Beauty & Fashion,Exclusive Members-Only Designs // Delivered Monthly
124,Box,The Book(ish) Box,Nerd & Novelty,"Every box includes a t-shirt in your size from Appraising Pages Shop, and 3-5 items. Each box has a cute theme & will feature new small shops. Expect to see home, beauty, and fashion items with the geeky, but stylish lady in mind."
125,Box,Spa Heroes,Beauty & Fashion,"The simplest way to safer skincare. Spa Heroes delivers non-toxic beauty to your door, one 'Hero Product' at a time. Use Less. Love More."
126,Box,Put This On,Just for Men,Put This On offers two subscription services -- The Inside Track and The Gentlemen's Association.
127,Box,PopSugar Must Have,Beauty & Fashion,"Featuring the best in fashion, beauty, home, fitness, food, and more delivered straight to your door."
128,Box,Lip Monthly,Beauty & Fashion,"For only $10/month, LipMonthly helps you discover the best lip products on the market."
129,Box,New Beauty Test Tube,Beauty & Fashion,The ultimate beauty sampling program.
130,Box,AZ Copper Creations,Beauty & Fashion,"One-of-a-kind hand crafted copper and stainless steel jewelry, made just for you and only for you every month. Pick a style, be unique!"
131,Box,Birchbox,Beauty & Fashion,"Get monthly deliveries of personalized beauty, grooming, and lifestyle samples, tailored to your profile."
132,Box,WaxBox,Just for Women,"WaxBox, a subscription box of scented wax melts and small candles."
133,Box,Prix Fixe Box,Beauty & Fashion,Jewelry to your doorstep. Impact far beyond. 10% of our proceeds go towards a charity that you choose from our pre-selected list.
134,Box,Pretty Girl Box,Beauty & Fashion,A monthly bath and beauty box for teens and young adults.
135,Box,Scarlett of Soho,Nerd & Novelty,Scarlett of Soho is a lifestyle service for those who find the process of buying glasses too painful.
136,Box,ShirtCrate,Just for Men,"ShirtCrate offers cool and unique Men's shirts every month for a low, flat fee. A trendy surprise in the mail every month!"
137,Box,Memebox,Beauty & Fashion,This carefully curated selection is the perfect introduction to the world of Korean beauty.
138,Box,From the Lab,Beauty & Fashion,"Each month, you will receive a full, 30-day supply of one, two, or three products of Skincare, Hair Care, or Color Cosmetics."
139,Box,Her Fashion Box,Beauty & Fashion,Discover the new way women are experiencing fashion.
140,Box,Lookfantastic Beauty Box,Beauty & Fashion,"Must have beauty fixes, wrapped in a beautifully presented box and delivered straight to your door."
141,Box,Starlooks,Beauty & Fashion,"Three, pro-quality, fashion forecasted Starlooks cosmetics delivered to your door monthly"
142,Box,Walmart Beauty Box,Beauty & Fashion,Walmart Beauty Box is a quarterly makeup and beauty sample subscription service featuring brands carried by Walmart.
143,Box,Scratch Monthly Mani Box,Beauty & Fashion,"Guaranteed, limited edition nail wrap collection."
144,Box,Underclub,Beauty & Fashion,"Never shop for underwear again! Get a new luxury pair every month, hand picked for your style and delivered to your doorstep."
145,Box,Fair Trade Friday Earring Of The Month,Beauty & Fashion,"High quality, stylish pair of fair trade earrings to your mailbox every month!"
146,Box,Wet Shave Club - Women's Box,Just for Women,"Fine women's shaving goods, delivered monthly. We're bringing back the art of traditional shaving, one silky smooth leg at a time."
147,Box,SilkCrate,Eco & Natural,"Have high quality, handmade bath and spa goodies delivered to your door monthly."
148,Box,Trunk Club,Just for Men,A personal stylist will help build your wardrobe online or in person—leaving you time for everything else.
149,Box,Frank & Oak Hunt Club,Just for Men,We bring you a new collection of modern menswear every month so you can look your best every day.
150,Box,Beauty Joy,Beauty & Fashion,"Receive one hand-curated Jewelry Item, one Full Size Beauty Item, and 2-3 deluxe samples."
151,Box,SneakerBox,Just for Men,"We’re your hook-up to the latest sneaker accessories & apparel including shoe laces, socks, t-shirts, hats, cleaning solutions and more."
152,Box,SprezzaBox,Just for Men,"4-5 lifestyle items, a grooming product, discount codes and more."
153,Box,Manpacks,Just for Men,"Your manly basics like socks, underwear, razors, and toiletries delivered every three months – or whenever you need it."
154,Box,Me Undies,Beauty & Fashion,"Me Undies is a underwear and t-shirt subscription service. Pick the style of underwear or tee you want, and get a new pair every month."
155,Box,The Beaver Box,Just for Women,A stylish subscription box delivered quarterly to Canadian Women.
156,Box,The Mr. Collection,Father's Day,The Mr. Collection is a monthly styling service for men who want to rent clothing and accessories with the option to buy at a discount.
157,Box,Razor Run,Nerd & Novelty,Experience a shave like never before and be part of our growing family of wet shavers. We will take care of all your wet shaving needs.
158,Box,Best Kept Rx,Just for Women,"Put your self-care on autopilot with a dose of Best Kept Rx - Practical products for busy women, delivered to doorsteps four times a year."
159,Box,Gwynnie Bee,Just for Women,Gwynnie Bee is a clothing rental subscription service catering to women sizes 10–32.
160,Box,Sperobox,Just for Women,One time or subscription box to empower women globally & equips you to advocate.
161,Box,Sockscribe Me,Beauty & Fashion,"Each month we will send you a pair of incredible socks. You won’t know what design you’ll get, but that’s part of the Sockscribe Me thrill."
162,Box,Prospurly,Food & Artisan Edibles,"An artisanal monthly subscription crafted for mind, body and soul."
163,Box,SugarBash,Just for Women,"A lifestyle box that features deluxe or full-size products only. A typical box has beauty, tech, fitness & food items valued at $50 or more."
164,Box,Love Lula Beauty Box,Beauty & Fashion,Natural Beauty Delivered Monthly To Your Door.
165,Box,TIEmSquare,Father's Day,"Premium Neckties and Pocket Squares on Autopilot, inspired by New York City. TIEmSquare is an exclusive menswear Membership service."
166,Box,BabeBoxx,Beauty & Fashion,"At BabeBoxx, we provide you with all the amazing beauty products-- exactly the kind of monthly treat that you deserve."
167,Box,LaRitzy,Beauty & Fashion,Get monthly deliveries of full-sized all-natural skincare products.
168,Box,The Butter Box,Eco & Natural,"Every Month in The Butter Box is 100% natural, we never use any chemicals or chemically-altered natural ingredients!"
169,Box,Crazy Kawaii Surprises,Art & Culture,"Monthly Subscription Box with Tokyo Kawaii fashion style. Included Jewelry, Bag, and other accessories with cute, fancy, sweet and dreamin!"
170,Box,Style Check-In,Beauty & Fashion,Style Check-In is your one-way ticket to a first-class wardrobe. Receive a monthly carry-on to elevate your style.
171,Box,Le Tote,Beauty & Fashion,Always have something new to wear.
172,Box,Nails R Accessories,Beauty & Fashion,Nail~R~Accessories is a monthly subscription box that began as a way to give women on- the- go a convenient way to have fun & fabulous nails.
173,Box,MyLadyBug,Just for Women,"A monthly period subscription service that deliver your monthly products direct to your door, just when you need it the most."
174,Box,Chic StyleBox,Beauty & Fashion,"The Chic StyleBox provides you the essentials to try new trends, up and coming lines, and hot fashion that is picked by our proven stylists."
175,Box,Cutie Crate,Beauty & Fashion,We deliver New POP Japanese make up and beauty products every month ! Eye opening make up products from Japan.
176,Box,Aromatic Blackbox,Beauty & Fashion,Perfume Vault & Bathory custom fragrance ? luxe skincare ? curated subscription
177,Box,Monthly Tees Club,Beauty & Fashion,Get 2 trendy Tees for the price of 1 delivered to your door every month. Choose from our monthly designs or upload your own!
178,Box,Foxy Boxes,Fitness & Health,"Each month, as a member, you will receive a box loaded with supplements, healthy snacks, accessories and nutrition products."
