image_num,format,name,category,description
533,Box,Chimasu,Food & Artisan Edibles,We are making Oriental snacks more readily available. Each month we send you a handpicked selection of snacks based on your preferences.
534,Box,Choco Rush,Food & Artisan Edibles,Choco Rush is a monthly bean to bar craft chocolate subscription club with chocolates from the finest chocolate makers. Eat Real Chocolate
535,Box,Japan Crate,Food & Artisan Edibles,Japan Crate is a monthly subscription that sends you candy straight from Tokyo!
536,Box,Mindfulness Box,Eco & Natural,"Looking for balance, positivity & zen? Mindfulness Box provides simple reminders & inspiring goods sure to encourage living in the moment."
537,Box,My Bakers Box,Food & Artisan Edibles,"A monthly subscription box that will be delivered directly to your door. It will include baking ideas, samples, recipes and more!"
538,Box,Student Velocity,Eco & Natural,"Subscription box service for Canadian students. Get delicious snacks, and exciting gifts right to your dorm, apartment, or home!"
539,Box,Stewarts Coffees,Food & Artisan Edibles,"We believe in making every day count, that life is about creating perfect moments. Fresh, local coffee delivered to you."
540,Box,Try Treats,Food & Artisan Edibles,Explore the world through food. Experience new flavors you never knew existed.
541,Box,The Community Chest,Food & Artisan Edibles,"The Community Chest subscription box is your monthly exploration of the many talented artisans creating quality products in Phoenix, AZ."
542,Box,BBQ Kings Club,Food & Artisan Edibles,"Get an award winning, curated selection of BBQ sauces, rubs, recipes and more delivered to you door each month."
543,Box,Classy Man Shave Club,Just for Men,Classy Man Shave Club is a monthly box for Wet Shaving. Providing the tools and handmade artisan shaving products to your door every month.
544,Box,GHOST Spice Supply,Food & Artisan Edibles,GHOST Spice Supply is a monthly spice subscription service with a mission of turning novice home cooks into confident home chefs.
545,Box,Birchbox Man,Just for Men,Get a personalized assortment of grooming and style upgrades delivered to your door each month. Your monthly box includes 3-4 grooming samples and a handsome accessory.
546,Box,Better Half Box,Food & Artisan Edibles,Better half box offers two thoughtfully curated boxes centered around a new and exciting theme every month. One for Guys and one for Gals.
547,Box,Harry's,Father's Day,"Harry's was built out of respect, for quality craftsmanship, simple design, modern convenience and most importantly for guys who know they shouldn't have to overpay for a great shave."
548,Box,The Handy Box,Art & Culture,"Whether you're away at college, looking for the perfect gift, or working on a home project, The Handy Box Subscription Box is a must have for every home."
549,Box,Gentleman's Box,Just for Men,Gentleman's Box is a premier subscription service providing the required essentials for the modern man. Each box has a unique theme with products sure to impress.
550,Box,Wet Shave Club,Father's Day,Discover awesome wet shaving items every month. Free razor & brush in your first box!
551,Box,Root Bizzle: Menswear on Autopilot,Father's Day,"Looking to put your menswear on autopilot? We learn your style preferences to send you the perfect ties and socks, each month."
552,Box,The Personal Barber,Just for Men,"The gentleman's monthly shaving subscription, providing top quality traditional shaving goods to keep you loving the morning routine"
553,Box,Ozone Sock Club,Beauty & Fashion,Treat your feet each month with a fresh pair of Ozone Socks!
554,Box,Bombfell,Father's Day,"With Bombfell, you'll get access to the world's leading menswear designers, including well-known brands like Ben Sherman and French Connection."
555,Box,ZampleBox,Food & Artisan Edibles,A delicious assortment of the best e juices delivered monthly. Less than $1/day. Vaping made easy.
556,Box,Bespoke Post,Food & Artisan Edibles,"Bespoke Post is a monthly subscription that delivers small-batch, artisan-crafted products for the everyday man. Unique Lifestyle Products for Men. In a Monthly Themed Box of Awesome."
557,Box,Put This On,Just for Men,Put This On offers two subscription services -- The Inside Track and The Gentlemen's Association.
558,Box,Hustle & Grind Co.,Food & Artisan Edibles,"A monthly box of coffee, hustler swag, epic gear and more!"
559,Box,Dollar Beard Club,Just for Men,We make beard care affordable by offering members wholesale pricing on ultra high quality products.
560,Box,Mystery Tackle Box,Just for Men,Mystery Tackle Box helps fisherman discover new fishing lures and learn new techniques every month.
561,Box,The Gin Crowd,Just for Men,Get handpicked craft gin delivered every month.
562,Box,Wrestle Crate,Nerd & Novelty,Wrestle Crate is a Pro Wrestling themed subscription service. A monthly mystery crate filled with wrestling awesomeness!
563,Box,ShirtCrate,Just for Men,"ShirtCrate offers cool and unique Men's shirts every month for a low, flat fee. A trendy surprise in the mail every month!"
564,Box,Pro Wrestling Loot,Nerd & Novelty,"Pro Wrestling Goodies EACH and every month. You will receive merchandise ranging from DVD's, T-Shirts, Action Figures & MUCH MORE!"
565,Box,Trunk Club,Just for Men,A personal stylist will help build your wardrobe online or in person—leaving you time for everything else.
566,Box,Primal Man Shave Club,Just for Men,"Each month you will receive a different selection of the finest quality, hand picked shaving items."
567,Box,Frank & Oak Hunt Club,Just for Men,We bring you a new collection of modern menswear every month so you can look your best every day.
568,Box,JackedPack,Just for Men,"Be the first to try new supplements, bulk up and become a body building machine!"
569,Box,Pijon Box,Food & Artisan Edibles,"Delicious and healthy snacks, health and beauty supplies, household essentials, and fun gifts for college students."
570,Box,SneakerBox,Just for Men,"We’re your hook-up to the latest sneaker accessories & apparel including shoe laces, socks, t-shirts, hats, cleaning solutions and more."
571,Box,SprezzaBox,Just for Men,"4-5 lifestyle items, a grooming product, discount codes and more."
572,Box,Manpacks,Just for Men,"Your manly basics like socks, underwear, razors, and toiletries delivered every three months – or whenever you need it."
573,Box,Me Undies,Beauty & Fashion,"Me Undies is a underwear and t-shirt subscription service. Pick the style of underwear or tee you want, and get a new pair every month."
574,Box,Curator and Mule,Just for Men,"Guy approved gear guaranteed to match your style. Each season, we'll ship you a package of ridiculously cool gear from the hottest up and coming brands."
575,Box,Tackle Grab,Father's Day,"Each month you receive a box in the mail with baits selected to match your fishing preferences, style, and ability."
576,Box,The Mr. Collection,Father's Day,The Mr. Collection is a monthly styling service for men who want to rent clothing and accessories with the option to buy at a discount.
577,Box,Razor Run,Nerd & Novelty,Experience a shave like never before and be part of our growing family of wet shavers. We will take care of all your wet shaving needs.
578,Box,Cooler Can Monthly,Nerd & Novelty,"Every month, our members receive awesome koozies from the coolest places in America. No commitment. Free shipping."
579,Box,Date in a Crate,Eco & Natural,"Improving relationships, one night at a time by providing monthly date night boxes that save time, money, and stress. All you do is enjoy the moment."
580,Box,Mantry,Father's Day,Each; Mantry includes 6 full size artisan food products delivered to their door.
581,Box,BattlBox,Father's Day,"Welcome to Battlbox, your monthly subscription for receiving hand-picked tactical, survival, and edc gear! This ain't your girlfriends box! Save 10% with coupon code: CJMRKTPLC10"
582,Box,Fabletics,Fitness & Health,"High-quality, stylish athletic wear co-founded by Kate Hudson and designed for great fit and function."
583,Box,Noble Brewer,Food & Artisan Edibles,"Fantastic box of 4 22oz. bottles of homebrewer-inspired craft beer, delivered to your door quarterly."
584,Box,Blue Apron,Food & Artisan Edibles,Say goodbye to grocery shopping with gourmet recipes delivered weekly to your home.
585,Box,Dollar Shave Club,Father's Day,A great shave for a few bucks a month.
586,Box,Five Four Club,Father's Day,"Effortless style created just for you, delivered right to your doorstep!"
587,Box,Lovebird,Just for Women,"We bring fun, memory making dates, to your door, monthly. So don't worry about a thang! We do all the work of date creating for you."
588,Box,Athletic Foodie,Food & Artisan Edibles,"All-natural snacks, for athletes, that are designed by a sports dietitian team, to help athletes perform at their best."
589,Box,Fuego Box,Food & Artisan Edibles,A hot sauce of the month club focused on craft and small batch hot sauces. Join to get the best hot sauces you've probably never heard of.
590,Box,Gear Supply Co.,Art & Culture,Subscription guitar strings hand wound in the USA and delivered to your door every month.
591,Box,Coffee Crate,Food & Artisan Edibles,"Every month, you will receive three 4oz packages of NC roasted coffee. Try 36 different NC roasters over the course of a year."
592,Box,TIEmSquare,Father's Day,"Premium Neckties and Pocket Squares on Autopilot, inspired by New York City. TIEmSquare is an exclusive menswear Membership service."
593,Box,Campbox Company,Fitness & Health,We curate camping & hiking gear based on seasonal weather. Our goal is keeping you prepared anytime adventure calls.
594,Box,My BBQ Box,Food & Artisan Edibles,"Become a BBQ pro. Get the rub, the guide and a special surprise every month. We even throw in an extra bottle of rub for a buddy"
595,Box,Monthly Tees Club,Beauty & Fashion,Get 2 trendy Tees for the price of 1 delivered to your door every month. Choose from our monthly designs or upload your own!
596,Box,Stuff You Need Cheap,Just for Men,Stop going commando and burning holes through your socks! Step up your game with a monthly delivery of quality killer socks and underwear.
597,Box,The Shirt Co.,Just for Men,"Beautiful tailored shirts, picked by a professional stylist. Delivered monthly, seasonally, or as often as you need."
598,Box,Amenities Box,Just for Men,"Amenities Box is a subscription box that has all personal amenities and products including soap, deodorant, shampoo, toothpaste and more."
599,Box,Luxury Barber Box,Just for Men,The Luxury Barber Box sends you over ten handpicked artisan men's grooming products delivered right to your doorstep hassle free.
600,Box,Chef Tools,Food & Artisan Edibles,"Providing chef tools to professional chefs, apprentice chefs, student chefs, aspiring culinary enthusiasts of every kind."
601,Box,The BuckBin,Art & Culture,A Social subscription that gets the party started. New and innovative items that take your weekend to the next level.
602,Box,Very Portland,Food & Artisan Edibles,"Ironically made in Portland, we're the monthly subscription service featuring the best local artisans in our city."
603,Box,Prepper Gear Box,Fitness & Health,A new monthly subscription box service for those who like survival gear and education. Save 10% off your first box with code: CRATE10
604,Box,Le Parcel,Just for Women,"Le Parcel, your monthly subscription of tampons + chocolates + curated gifts. Yes please!"
605,Box,Rocksbox,Beauty & Fashion,"With Rocksbox, receive a curated box of designer gems you can borrow, buy or swap at any time."
606,Box,Little Lace Box,Just for Women,Three sisters curating the most unique subscription box around. Bringing fresh new artisans and designers to your world.
607,Box,CAUSEBOX,Just for Women,"Receive a box of socially conscious women's products each season, handpicked by Sevenly."
608,Box,Better Half Box,Food & Artisan Edibles,Better half box offers two thoughtfully curated boxes centered around a new and exciting theme every month. One for Guys and one for Gals.
609,Box,Golden Tote,Beauty & Fashion,"Ladies, get ready to get hooked on two of your favorite things—clothing and surprises!"
610,Box,Flicker Box,Art & Culture,A variety of artisanal candles made from candle artists in the U.S.A
611,Box,GlossyBox,Beauty & Fashion,Exclusive cosmetic samples and perfume samples from the best makeup brands online
612,Box,Prize Candle,Eco & Natural,"Discover a beautiful ring hidden in every soy candle AND a chance to win a prize up to $5,000."
613,Box,Yogi Surprise Lifestyle Box,Eco & Natural,A yoga inspired monthly delivery designed to complement your active lifestyle of vitality and growth
614,Box,The Handy Box,Art & Culture,"Whether you're away at college, looking for the perfect gift, or working on a home project, The Handy Box Subscription Box is a must have for every home."
615,Box,Fandom of the Month Club,Nerd & Novelty,Subscribe to start receiving your own monthly fandom jewelry!
616,Box,BareBox,Beauty & Fashion,BareBox delivers incredible organic bath and beauty products every month.
617,Box,Cate & Chloe VIP,Beauty & Fashion,Get Two new pieces of the hottest fashion jewelry delivered to your door every month! It is yours to love and keep forever!
618,Box,Wantable,Beauty & Fashion,Our personal stylists navigate the world of fashion and beauty to bring you the latest trends.
619,Box,Moon Magic Box,Eco & Natural,"The Moon Magic Box is a collection of treasures, gifts and surprises that aid in tuning and energizing your body, mind and spirit!"
620,Box,CMYFABRIK Box,Art & Culture,Custom fabric + sewing kit + sewing project OR a new sew project (you choose!)
621,Box,Beauty Box Five,Beauty & Fashion,"5 deluxe pretty samples that'll make you race to your mailbox, for $12 a month. We're obsessed with making beauty fun again!"
622,Box,International Blessings,Beauty & Fashion,"Unique, beautiful jewelry and products fighting poverty! Handmade by impoverished artisans. 10% donation goes to poverty fighting causes."
623,Box,Dotbox,Just for Women,A Box for whatever mother nature throws at you. Period. All your menstrual needs delivered straight to your front door every month.
624,Box,Box of Style,Just for Women,"Fashion, beauty and lifestyle items you'll be obsessed with."
625,Box,FabFitFun VIP Box,Just for Women,"Full-size, premium products delivered 4x per year."
626,Box,Ozone Sock Club,Beauty & Fashion,Treat your feet each month with a fresh pair of Ozone Socks!
627,Box,Style Quarterly,Beauty & Fashion,Style Quarterly delivers products such as Elucx's Rose Milk Bath Soak and Rifle Paper and Co's Travel Journals to our members each season.
628,Box,Filled.Life,Just for Women,"Monthly subscription crate for ladies, 10% of proceeds donated to charity/ministries"
629,Box,Yogi Surprise Jewelry Box,Just for Women,"Beautiful, handcrafted yoga inspired jewelry pieces delivered monthly"
630,Box,Fresh Fiction Box Not TO Miss,Nerd & Novelty,"When you sign up for Fresh Fiction Box Not to Miss, you will receive a box with a new release print book, free eBooks and tons of swag."
631,Box,ZampleBox,Food & Artisan Edibles,A delicious assortment of the best e juices delivered monthly. Less than $1/day. Vaping made easy.
632,Box,Kites & Ivy,Just for Women,Products & Presents delivered to your door twice per semester - Designed with today's college woman in mind
633,Box,The Book(ish) Box,Nerd & Novelty,"Every box includes a t-shirt in your size from Appraising Pages Shop, and 3-5 items. Each box has a cute theme & will feature new small shops. Expect to see home, beauty, and fashion items with the geeky, but stylish lady in mind."
634,Box,Spa Heroes,Beauty & Fashion,"The simplest way to safer skincare. Spa Heroes delivers non-toxic beauty to your door, one 'Hero Product' at a time. Use Less. Love More."
635,Box,PopSugar Must Have,Beauty & Fashion,"Featuring the best in fashion, beauty, home, fitness, food, and more delivered straight to your door."
636,Box,Sapphire Soul,Just for Women,"A monthly box focused on self-care and keeping the body, mind and soul connected. Seek then find inspiration & spiritual beauty!"
637,Box,Hustle & Grind Co.,Food & Artisan Edibles,"A monthly box of coffee, hustler swag, epic gear and more!"
638,Box,Birchbox,Beauty & Fashion,"Get monthly deliveries of personalized beauty, grooming, and lifestyle samples, tailored to your profile."
639,Box,WaxBox,Just for Women,"WaxBox, a subscription box of scented wax melts and small candles."
640,Box,Mystical Mojo Box,Eco & Natural,Assisting You In Your Spiritual Journey. Is it time to fill up your spiritual toolbox? Mystical Goodies delivered monthly
641,Box,From the Lab,Beauty & Fashion,"Each month, you will receive a full, 30-day supply of one, two, or three products of Skincare, Hair Care, or Color Cosmetics."
642,Box,Her Fashion Box,Beauty & Fashion,Discover the new way women are experiencing fashion.
643,Box,Lookfantastic Beauty Box,Beauty & Fashion,"Must have beauty fixes, wrapped in a beautifully presented box and delivered straight to your door."
644,Box,Starlooks,Beauty & Fashion,"Three, pro-quality, fashion forecasted Starlooks cosmetics delivered to your door monthly"
645,Box,Walmart Beauty Box,Beauty & Fashion,Walmart Beauty Box is a quarterly makeup and beauty sample subscription service featuring brands carried by Walmart.
646,Box,Scratch Monthly Mani Box,Beauty & Fashion,"Guaranteed, limited edition nail wrap collection."
647,Box,Fair Trade Friday Earring Of The Month,Beauty & Fashion,"High quality, stylish pair of fair trade earrings to your mailbox every month!"
648,Box,Wet Shave Club - Women's Box,Just for Women,"Fine women's shaving goods, delivered monthly. We're bringing back the art of traditional shaving, one silky smooth leg at a time."
649,Box,Box Me Mommy,Eco & Natural,Enjoy a monthly box of fun for mommy and baby.
650,Box,PrettyFit,Fitness & Health,"Each month, we assemble a box of the best nutritional supplements, healthy snacks, workout gear and more, chosen by top fitness professionals."
651,Box,Her Fitness Box,Fitness & Health,Her Fitness Box is a monthly wellness and fitness subscription. Helping you stay on track with your fitness goals.
652,Box,SilkCrate,Eco & Natural,"Have high quality, handmade bath and spa goodies delivered to your door monthly."
653,Box,Pijon Box,Food & Artisan Edibles,"Delicious and healthy snacks, health and beauty supplies, household essentials, and fun gifts for college students."
654,Box,Beauty Joy,Beauty & Fashion,"Receive one hand-curated Jewelry Item, one Full Size Beauty Item, and 2-3 deluxe samples."
655,Box,Me Undies,Beauty & Fashion,"Me Undies is a underwear and t-shirt subscription service. Pick the style of underwear or tee you want, and get a new pair every month."
656,Box,The Beaver Box,Just for Women,A stylish subscription box delivered quarterly to Canadian Women.
657,Box,Date in a Crate,Eco & Natural,"Improving relationships, one night at a time by providing monthly date night boxes that save time, money, and stress. All you do is enjoy the moment."
658,Box,Best Kept Rx,Just for Women,"Put your self-care on autopilot with a dose of Best Kept Rx - Practical products for busy women, delivered to doorsteps four times a year."
659,Box,Gwynnie Bee,Just for Women,Gwynnie Bee is a clothing rental subscription service catering to women sizes 10–32.
660,Box,Fabletics,Fitness & Health,"High-quality, stylish athletic wear co-founded by Kate Hudson and designed for great fit and function."
661,Box,BlushBox,Just for Women,"BlushBox is dedicated to helping women embrace their sexy side in a classy, fun and stylish way."
662,Box,Bag and Wander,Just for Women,Delivering practical travel-size essentials to keep you comfortable & prepared on-the-go.
663,Box,TOM Boxes,Just for Women,Supplies for that time of the month and more.
664,Box,Monthly Express,Eco & Natural,Discover the luxurious relaxation inside each of our collections.
665,Box,Lovebird,Just for Women,"We bring fun, memory making dates, to your door, monthly. So don't worry about a thang! We do all the work of date creating for you."
666,Box,Sperobox,Just for Women,One time or subscription box to empower women globally & equips you to advocate.
667,Box,SugarBash,Just for Women,"A lifestyle box that features deluxe or full-size products only. A typical box has beauty, tech, fitness & food items valued at $50 or more."
668,Box,21 Bundles,Family & Kids,"We deliver monthly bundles of natural products to pregnant and new Moms, tailored to their stage of pregnancy or their baby's age."
669,Box,Ecocentric Mom,Eco & Natural,"The best place for a healthy, ecocentric, and all-natural lifestyle! Join our community!"
670,Box,Love Lula Beauty Box,Beauty & Fashion,Natural Beauty Delivered Monthly To Your Door.
671,Box,holBOX,Eco & Natural,Monthly subscription service for women seeking to transition into living holistically.
672,Box,LaRitzy,Beauty & Fashion,Get monthly deliveries of full-sized all-natural skincare products.
673,Box,BabeBoxx,Beauty & Fashion,"At BabeBoxx, we provide you with all the amazing beauty products-- exactly the kind of monthly treat that you deserve."
674,Box,FanMail,Nerd & Novelty,Subscription Box for Lady Geeks: Filled with your favorite fandom stuff!
675,Box,The Butter Box,Eco & Natural,"Every Month in The Butter Box is 100% natural, we never use any chemicals or chemically-altered natural ingredients!"
676,Box,Your Secret Admirer,Just for Women,Your Secret Admirer delivers a box of hand-selected items designed to make every woman feel appreciated.
677,Box,Crazy Kawaii Surprises,Art & Culture,"Monthly Subscription Box with Tokyo Kawaii fashion style. Included Jewelry, Bag, and other accessories with cute, fancy, sweet and dreamin!"
678,Box,Style Check-In,Beauty & Fashion,Style Check-In is your one-way ticket to a first-class wardrobe. Receive a monthly carry-on to elevate your style.
679,Box,Le Tote,Beauty & Fashion,Always have something new to wear.
680,Box,MyLadyBug,Just for Women,"A monthly period subscription service that deliver your monthly products direct to your door, just when you need it the most."
681,Box,Konenkii,Just for Women,Konenkii's Summer LaunchBox is THE quarterly subscription box for the MODERN WOMAN who wants to age fearlessly and with a touch of humor.
682,Box,Decoterie: Monthly Decor Subscription Box,Just for Women,"Home decor box for a cause. Exclusive homewares, decorative accessories; objects of desire curated by Letitia Elizabeth. 10% goes to charity"
683,Box,Chic StyleBox,Beauty & Fashion,"The Chic StyleBox provides you the essentials to try new trends, up and coming lines, and hot fashion that is picked by our proven stylists."
684,Box,Aromatic Blackbox,Beauty & Fashion,Perfume Vault & Bathory custom fragrance ? luxe skincare ? curated subscription
685,Box,Monthly Tees Club,Beauty & Fashion,Get 2 trendy Tees for the price of 1 delivered to your door every month. Choose from our monthly designs or upload your own!
686,Box,Foxy Boxes,Fitness & Health,"Each month, as a member, you will receive a box loaded with supplements, healthy snacks, accessories and nutrition products."
687,Box,FlourishBox,Beauty & Fashion,"Handcrafted, globally sourced scarves, plus two extra fair trade treats."
688,Box,Pure Good Spa Kit,Eco & Natural,"Treat yourself to a weekly spa retreat with four facial treatments that soothe, heal and brighten both your dermis and your soul."
689,Box,The Planner Addict Box,Just for Women,Get handpicked planner supplies delivered every month.
690,Box,nailbox,Just for Women,"nailbox is a brand new, monthly subscription box full of the hottest nail polish and essential nail tools."
691,Box,Smile Designed,Just for Women,Need encouragement? Our boxes can help. We offer monthly and one time boxes that bring personalized encouragement to your door.
692,Box,All Things Needed,Just for Women,Get samples created for women and provided by women delivered right to your door every month!
693,Box,CatLadyBox,Just for Women,"Unique finds for cat lovers, delivered to your door each month. Get cat-themed jewelry, clothes, accessories, decor, books and more!"
694,Box,Chef Tools,Food & Artisan Edibles,"Providing chef tools to professional chefs, apprentice chefs, student chefs, aspiring culinary enthusiasts of every kind."
695,Box,The BuckBin,Art & Culture,A Social subscription that gets the party started. New and innovative items that take your weekend to the next level.
696,Box,Pipsticks,Art & Culture,Pipsticks sends an awesome pack of curated stickers from suppliers around the world to our subscribers every month. Sticker lovers unite!
697,Box,Avalai,Just for Women,"Avalai is a monthly subscription service for your period. It includes all the feminine hygiene supplies you need, and the goodies you want."
698,Box,Very Portland,Food & Artisan Edibles,"Ironically made in Portland, we're the monthly subscription service featuring the best local artisans in our city."
699,Box,Helene Jewelry,Beauty & Fashion,Want some ArmCandy to Show-Off? Subscribe to receive a box full of trendy bracelets and other goodies selected just for you each month.
700,Box,Alabaster Box,Just for Women,"Alabaster Box is a Christian based "" pay it forward subscription service for women."""
701,Box,MoonBox by Gaia Collective,Eco & Natural,Deepen your connection with a MoonBox subscription.
702,Box,ilybox,Family & Kids,"Monthly box of hope, love & inspiration through ilycards, challenges & products. For every box purchased, one is given to someone in need."
703,Box,CraftyKatie,Art & Culture,A monthly subscription box for arts and crafts lovers filled with hand-made items!
704,Box,Scent Trunk,Nerd & Novelty,Your perfect scents delivered on your schedule
